{
  "$schema": "https://json-schema.org/draft/2020-12/schema",
  "type": "object",
  "properties": {
    "version": {
      "type": "number",
      "const": 3
    },
    "note": {
      "type": "object",
      "properties": {
        "id": {
          "type": "string",
          "minLength": 1
        },
        "text": {
          "type": "string",
          "minLength": 1,
          "maxLength": 4000
        },
        "localTime": {
          "type": "string",
          "pattern": "^\\d{4}-\\d{2}-\\d{2}T\\d{2}:\\d{2}$"
        },
        "timeZone": {
          "type": "string",
          "minLength": 1
        },
        "day": {
          "type": "string",
          "pattern": "^\\d{4}-\\d{2}-\\d{2}$"
        }
      },
      "required": [
        "id",
        "text",
        "localTime",
        "timeZone",
        "day"
      ]
    },
    "dayBoundary": {
      "default": 240,
      "type": "integer",
      "minimum": 0,
      "maximum": 720
    },
    "categories": {
      "minItems": 1,
      "type": "array",
      "items": {
        "type": "object",
        "properties": {
          "key": {
            "type": "string",
            "minLength": 1
          },
          "name": {
            "type": "string",
            "minLength": 1
          },
          "emoji": {
            "default": "",
            "type": "string"
          },
          "parent": {
            "type": [
              "string",
              "null"
            ]
          },
          "measure": {
            "default": "duration",
            "type": "string"
          },
          "synonyms": {
            "default": [],
            "type": "array",
            "items": {
              "type": "string"
            }
          },
          "color": {
            "default": "stone",
            "type": "string"
          },
          "order": {
            "default": 500,
            "type": "integer",
            "minimum": -9007199254740991,
            "maximum": 9007199254740991
          }
        },
        "required": [
          "key",
          "name"
        ]
      }
    },
    "existing": {
      "default": [],
      "type": "array",
      "items": {
        "type": "object",
        "properties": {
          "id": {
            "type": "string",
            "minLength": 1
          },
          "day": {
            "type": "string",
            "pattern": "^\\d{4}-\\d{2}-\\d{2}$"
          },
          "data": {
            "oneOf": [
              {
                "type": "object",
                "properties": {
                  "kind": {
                    "type": "string",
                    "const": "event"
                  },
                  "category": {
                    "type": "string"
                  },
                  "label": {
                    "type": "string",
                    "minLength": 1
                  },
                  "start": {
                    "type": "string",
                    "pattern": "^\\d{4}-\\d{2}-\\d{2}T\\d{2}:\\d{2}$"
                  },
                  "end": {
                    "type": "string",
                    "pattern": "^\\d{4}-\\d{2}-\\d{2}T\\d{2}:\\d{2}$"
                  },
                  "durationMin": {
                    "type": "number",
                    "exclusiveMinimum": 0
                  },
                  "metrics": {
                    "default": [],
                    "type": "array",
                    "items": {
                      "type": "object",
                      "properties": {
                        "name": {
                          "type": "string",
                          "minLength": 1
                        },
                        "value": {
                          "type": "number"
                        },
                        "unit": {
                          "default": "",
                          "type": "string"
                        },
                        "item": {
                          "type": "string"
                        },
                        "for": {
                          "type": "string"
                        },
                        "from": {
                          "type": "string"
                        }
                      },
                      "required": [
                        "name",
                        "value"
                      ]
                    }
                  },
                  "note": {
                    "type": "string"
                  },
                  "people": {
                    "default": [],
                    "type": "array",
                    "items": {
                      "type": "string"
                    }
                  },
                  "things": {
                    "default": [],
                    "type": "array",
                    "items": {
                      "type": "string"
                    }
                  },
                  "places": {
                    "default": [],
                    "type": "array",
                    "items": {
                      "type": "string"
                    }
                  }
                },
                "required": [
                  "kind",
                  "category",
                  "label"
                ]
              },
              {
                "type": "object",
                "properties": {
                  "kind": {
                    "type": "string",
                    "const": "insight"
                  },
                  "title": {
                    "type": "string",
                    "minLength": 1
                  },
                  "quote": {
                    "type": "string",
                    "minLength": 1
                  },
                  "tags": {
                    "default": [],
                    "type": "array",
                    "items": {
                      "type": "string"
                    }
                  }
                },
                "required": [
                  "kind",
                  "title",
                  "quote"
                ]
              },
              {
                "type": "object",
                "properties": {
                  "kind": {
                    "type": "string",
                    "const": "todo"
                  },
                  "content": {
                    "type": "string",
                    "minLength": 1
                  },
                  "due": {
                    "type": "string",
                    "pattern": "^\\d{4}-\\d{2}-\\d{2}$"
                  },
                  "done": {
                    "default": false,
                    "type": "boolean"
                  },
                  "people": {
                    "default": [],
                    "type": "array",
                    "items": {
                      "type": "string"
                    }
                  },
                  "things": {
                    "default": [],
                    "type": "array",
                    "items": {
                      "type": "string"
                    }
                  },
                  "places": {
                    "default": [],
                    "type": "array",
                    "items": {
                      "type": "string"
                    }
                  }
                },
                "required": [
                  "kind",
                  "content"
                ]
              },
              {
                "type": "object",
                "properties": {
                  "kind": {
                    "type": "string",
                    "const": "mood"
                  },
                  "level": {
                    "type": "integer",
                    "minimum": 1,
                    "maximum": 5
                  },
                  "tone": {
                    "type": "string",
                    "enum": [
                      "good",
                      "neutral",
                      "bad",
                      "mixed"
                    ]
                  },
                  "strength": {
                    "type": "string",
                    "enum": [
                      "weak",
                      "medium",
                      "strong"
                    ]
                  },
                  "energy": {
                    "type": "integer",
                    "minimum": 1,
                    "maximum": 5
                  },
                  "emotions": {
                    "default": [],
                    "type": "array",
                    "items": {
                      "type": "string"
                    }
                  },
                  "moment": {
                    "type": "string"
                  }
                },
                "required": [
                  "kind",
                  "level"
                ]
              }
            ]
          },
          "question": {
            "type": "string"
          }
        },
        "required": [
          "id",
          "day",
          "data"
        ]
      }
    },
    "dialogue": {
      "default": [],
      "type": "array",
      "items": {
        "type": "object",
        "properties": {
          "text": {
            "type": "string"
          },
          "localTime": {
            "type": "string",
            "pattern": "^\\d{4}-\\d{2}-\\d{2}T\\d{2}:\\d{2}$"
          },
          "status": {
            "type": "string",
            "enum": [
              "done",
              "pending",
              "failed"
            ]
          },
          "actions": {
            "default": [],
            "type": "array",
            "items": {
              "type": "object",
              "properties": {
                "action": {
                  "type": "string",
                  "enum": [
                    "created",
                    "updated",
                    "duplicate",
                    "completed",
                    "confirmed",
                    "deleted"
                  ]
                },
                "recordId": {
                  "type": "string"
                },
                "text": {
                  "type": "string"
                }
              },
              "required": [
                "action",
                "recordId",
                "text"
              ]
            }
          },
          "reply": {
            "type": "string"
          },
          "questions": {
            "default": [],
            "type": "array",
            "items": {
              "type": "string"
            }
          },
          "undone": {
            "default": false,
            "type": "boolean"
          }
        },
        "required": [
          "text",
          "localTime",
          "status"
        ]
      }
    }
  },
  "required": [
    "version",
    "note",
    "categories"
  ]
}
