{
  "version": 3,
  "note": {
    "id": "0B6F3C2E-6B1D-4C8A-9E55-3A7D2F1C9B10",
    "text": "早上跑了五公里 中午和小王吃面三十二 房租交了",
    "localTime": "2026-10-18T12:40",
    "timeZone": "Asia/Shanghai",
    "day": "2026-10-18"
  },
  "dayBoundary": 240,
  "categories": [
    {
      "key": "sleep",
      "name": "睡眠",
      "emoji": "😴",
      "parent": null,
      "measure": "duration",
      "synonyms": [
        "睡觉",
        "午睡",
        "小睡",
        "补觉"
      ],
      "color": "wisteria",
      "order": 10
    },
    {
      "key": "exercise",
      "name": "运动",
      "emoji": "🏃",
      "parent": null,
      "measure": "duration",
      "synonyms": [
        "锻炼",
        "健身",
        "散步",
        "走路",
        "步数",
        "骑车",
        "游泳",
        "爬山",
        "打球",
        "拉伸",
        "太极",
        "太极拳",
        "广场舞",
        "跳绳",
        "羽毛球",
        "篮球",
        "足球",
        "乒乓球",
        "网球",
        "跳操",
        "徒步",
        "普拉提",
        "健走",
        "打拳",
        "动感单车",
        "骑行"
      ],
      "color": "moss",
      "order": 20
    },
    {
      "key": "run",
      "name": "跑步",
      "emoji": "🏃",
      "parent": "exercise",
      "measure": "duration",
      "synonyms": [
        "慢跑",
        "晨跑",
        "夜跑",
        "跑"
      ],
      "color": "moss",
      "order": 21
    },
    {
      "key": "strength",
      "name": "力量",
      "emoji": "🏋",
      "parent": "exercise",
      "measure": "duration",
      "synonyms": [
        "撸铁",
        "力量训练",
        "深蹲",
        "卧推"
      ],
      "color": "moss",
      "order": 22
    },
    {
      "key": "yoga",
      "name": "瑜伽",
      "emoji": "🧘",
      "parent": "exercise",
      "measure": "duration",
      "synonyms": [],
      "color": "moss",
      "order": 23
    },
    {
      "key": "diet",
      "name": "饮食",
      "emoji": "🍽",
      "parent": null,
      "measure": "count",
      "synonyms": [
        "吃饭",
        "三餐",
        "早饭",
        "午饭",
        "晚饭",
        "加餐",
        "喝水",
        "外卖",
        "轻断食",
        "168",
        "早餐",
        "午餐",
        "晚餐",
        "夜宵",
        "零食",
        "咖啡",
        "奶茶",
        "火锅",
        "烤肉",
        "麻辣烫",
        "聚餐",
        "下馆子",
        "点外卖"
      ],
      "color": "apricot",
      "order": 30
    },
    {
      "key": "study",
      "name": "学习",
      "emoji": "📚",
      "parent": null,
      "measure": "duration",
      "synonyms": [
        "看书",
        "读书",
        "上课",
        "背单词",
        "练琴",
        "写作业",
        "刷题",
        "自习",
        "考试",
        "网课",
        "复习",
        "预习",
        "听课",
        "做作业",
        "高数",
        "论文",
        "实验报告",
        "学英语",
        "背书",
        "学车",
        "练车",
        "考驾照",
        "驾校",
        "看小说"
      ],
      "color": "straw",
      "order": 40
    },
    {
      "key": "work",
      "name": "工作",
      "emoji": "💼",
      "parent": null,
      "measure": "duration",
      "synonyms": [
        "上班",
        "开会",
        "加班",
        "写方案",
        "写代码",
        "剪视频",
        "剪辑",
        "拍视频",
        "拍短视频",
        "做短视频",
        "开直播",
        "做直播",
        "直播带货",
        "写稿",
        "写文章",
        "公众号",
        "开店",
        "看店",
        "进货",
        "拿货",
        "对账",
        "盘点",
        "拜访客户",
        "见客户",
        "客户",
        "签单",
        "接单",
        "稿费",
        "工资",
        "发工资",
        "奖金",
        "改bug",
        "值班",
        "培训",
        "面试",
        "复盘",
        "甲方"
      ],
      "color": "lake",
      "order": 50
    },
    {
      "key": "other",
      "name": "其他",
      "emoji": "📌",
      "parent": null,
      "measure": "duration",
      "synonyms": [],
      "color": "stone",
      "order": 900
    }
  ],
  "existing": [
    {
      "id": "5A0E1D7C-2B44-4F0B-8C1E-9D3B6A2F4E01",
      "day": "2026-10-18",
      "data": {
        "kind": "event",
        "category": "sleep",
        "label": "睡眠",
        "start": "2026-10-17T23:30",
        "end": "2026-10-18T07:10",
        "durationMin": 460,
        "metrics": [],
        "people": [],
        "things": [],
        "places": []
      }
    },
    {
      "id": "7C2D9E4B-1A3F-4E6D-8B5C-0F9A2D7E3C02",
      "day": "2026-10-17",
      "data": {
        "kind": "todo",
        "content": "交房租",
        "due": "2026-10-19",
        "done": false,
        "people": [],
        "things": [],
        "places": []
      },
      "question": "是这个月的房租吗？"
    }
  ],
  "dialogue": [
    {
      "text": "明天交房租",
      "localTime": "2026-10-17T21:05",
      "status": "done",
      "actions": [
        {
          "action": "created",
          "recordId": "7C2D9E4B-1A3F-4E6D-8B5C-0F9A2D7E3C02",
          "text": "待办：交房租"
        }
      ],
      "questions": [
        "是这个月的房租吗？"
      ],
      "undone": false
    }
  ]
}
